{
  "schema_version": 1,
  "run_id": "11111111-1111-4111-8111-111111111111",
  "boot_id": "22222222-2222-4222-8222-222222222222",
  "captured_at_utc": "2026-07-15T03:00:00Z",
  "boottime_ns": 123456789,
  "host": {
    "hostname": "kbl-target",
    "kernel_release": "6.6.0-openkylin",
    "os_id": "openkylin",
    "os_version_id": "2.0",
    "architecture": "x86_64"
  },
  "artifacts": [
    {
      "name": "systemd-time",
      "relative_path": "captures/systemd-time.json",
      "sha256": "0000000000000000000000000000000000000000000000000000000000000000",
      "size_bytes": 123,
      "command": ["systemd-analyze", "--no-pager", "time"],
      "exit_code": 0,
      "required": true
    }
  ]
}
